{
  "event_id": "20260925-001-sample-001",
  "event_type": "BRAND_REGISTERED",
  "aggregate_type": "brand",
  "aggregate_id": "brand_minchi",
  "occurred_at": "2026-09-25T08:00:00+08:00",
  "version": 1,
  "summary": "公用品牌建档：闽地小吃（示例事件）",
  "payload": {
    "name": "闽地小吃",
    "officeName": "闽地小吃公用品牌办公室"
  }
}
